{
  "class": [
    "screen",
    "tracking"
  ],
  "title": "Entrega TX02PX83TXC5G00",
  "properties": {
    "trackingCode": "TX02PX83TXC5G00",
    "status": "delivered",
    "statusLabel": "Entregue",
    "tone": "success",
    "carrier": "correio-nacional",
    "carrierLabel": "Correio Nacional",
    "destination": {
      "municipality": "Salvador",
      "state": "BA"
    },
    "updatedAt": "2026-09-28T00:50:19.827Z"
  },
  "entities": [
    {
      "class": [
        "timeline-step"
      ],
      "rel": [
        "item"
      ],
      "properties": {
        "status": "created",
        "label": "Pedido de envio criado",
        "at": "2026-09-28T00:47:27.467Z"
      }
    },
    {
      "class": [
        "timeline-step"
      ],
      "rel": [
        "item"
      ],
      "properties": {
        "status": "ready_for_pickup",
        "label": "Etiqueta pronta",
        "at": "2026-09-28T00:47:29.156Z"
      }
    },
    {
      "class": [
        "timeline-step"
      ],
      "rel": [
        "item"
      ],
      "properties": {
        "status": "picked_up",
        "label": "Coletado pela transportadora",
        "at": "2026-09-28T00:47:32.867Z"
      }
    },
    {
      "class": [
        "timeline-step"
      ],
      "rel": [
        "item"
      ],
      "properties": {
        "status": "in_transit",
        "label": "Em trânsito",
        "at": "2026-09-28T00:47:36.819Z",
        "hub": "Hub Contagem (MG)"
      }
    },
    {
      "class": [
        "timeline-step"
      ],
      "rel": [
        "item"
      ],
      "properties": {
        "status": "in_transit",
        "label": "Em trânsito",
        "at": "2026-09-28T00:48:09.571Z",
        "hub": "Hub Simões Filho (BA)"
      }
    },
    {
      "class": [
        "timeline-step"
      ],
      "rel": [
        "item"
      ],
      "properties": {
        "status": "out_for_delivery",
        "label": "Saiu para entrega",
        "at": "2026-09-28T00:49:15.964Z",
        "attempt": 1
      }
    },
    {
      "class": [
        "timeline-step"
      ],
      "rel": [
        "item"
      ],
      "properties": {
        "status": "delivered",
        "label": "Entregue",
        "at": "2026-09-28T00:50:19.827Z",
        "attempt": 1
      }
    },
    {
      "class": [
        "navigation"
      ],
      "rel": [
        "https://github.com/flaviotinococoutinho/chaos_playground/blob/develop/contracts/http/bff/README.md#rel-navigation"
      ],
      "properties": {
        "store": {
          "slug": "arara",
          "name": "Arara Livros",
          "palette": "arara",
          "initial": "A"
        },
        "shopper": null
      },
      "links": [
        {
          "rel": [
            "https://github.com/flaviotinococoutinho/chaos_playground/blob/develop/contracts/http/bff/README.md#rel-stores"
          ],
          "href": "/bff/v1",
          "title": "Todas as lojas"
        },
        {
          "rel": [
            "https://github.com/flaviotinococoutinho/chaos_playground/blob/develop/contracts/http/bff/README.md#rel-store"
          ],
          "href": "/bff/v1/stores/arara",
          "title": "Arara Livros"
        },
        {
          "rel": [
            "https://github.com/flaviotinococoutinho/chaos_playground/blob/develop/contracts/http/bff/README.md#rel-catalog"
          ],
          "href": "/bff/v1/stores/arara/products",
          "title": "Catálogo"
        },
        {
          "rel": [
            "https://github.com/flaviotinococoutinho/chaos_playground/blob/develop/contracts/http/bff/README.md#rel-orders"
          ],
          "href": "/bff/v1/stores/arara/orders",
          "title": "Meus pedidos"
        },
        {
          "rel": [
            "https://github.com/flaviotinococoutinho/chaos_playground/blob/develop/contracts/http/bff/README.md#rel-profiles"
          ],
          "href": "/bff/v1/profiles?store=arara",
          "title": "Entrar"
        }
      ]
    }
  ],
  "links": [
    {
      "rel": [
        "self"
      ],
      "href": "/bff/v1/stores/arara/tracking/TX02PX83TXC5G00"
    },
    {
      "rel": [
        "up"
      ],
      "href": "/bff/v1/stores/arara",
      "title": "Início"
    }
  ]
}
