{
  "class": [
    "screen",
    "orders"
  ],
  "title": "Meus pedidos",
  "properties": {
    "page": 1,
    "perPage": 10,
    "total": 0,
    "notice": {
      "tone": "info",
      "text": "Um pedido novo pode levar alguns segundos para aparecer aqui."
    }
  },
  "entities": [
    {
      "class": [
        "navigation"
      ],
      "rel": [
        "https://github.com/flaviotinococoutinho/chaos_playground/blob/develop/contracts/http/bff/README.md#rel-navigation"
      ],
      "properties": {
        "store": {
          "slug": "arara",
          "name": "Arara Livros",
          "palette": "arara",
          "initial": "A"
        },
        "shopper": null
      },
      "links": [
        {
          "rel": [
            "https://github.com/flaviotinococoutinho/chaos_playground/blob/develop/contracts/http/bff/README.md#rel-stores"
          ],
          "href": "/bff/v1",
          "title": "Todas as lojas"
        },
        {
          "rel": [
            "https://github.com/flaviotinococoutinho/chaos_playground/blob/develop/contracts/http/bff/README.md#rel-store"
          ],
          "href": "/bff/v1/stores/arara",
          "title": "Arara Livros"
        },
        {
          "rel": [
            "https://github.com/flaviotinococoutinho/chaos_playground/blob/develop/contracts/http/bff/README.md#rel-catalog"
          ],
          "href": "/bff/v1/stores/arara/products",
          "title": "Catálogo"
        },
        {
          "rel": [
            "https://github.com/flaviotinococoutinho/chaos_playground/blob/develop/contracts/http/bff/README.md#rel-orders"
          ],
          "href": "/bff/v1/stores/arara/orders",
          "title": "Meus pedidos"
        },
        {
          "rel": [
            "https://github.com/flaviotinococoutinho/chaos_playground/blob/develop/contracts/http/bff/README.md#rel-profiles"
          ],
          "href": "/bff/v1/profiles?store=arara",
          "title": "Entrar"
        }
      ]
    }
  ],
  "links": [
    {
      "rel": [
        "self"
      ],
      "href": "/bff/v1/stores/arara/orders?page=1"
    },
    {
      "rel": [
        "https://github.com/flaviotinococoutinho/chaos_playground/blob/develop/contracts/http/bff/README.md#rel-catalog"
      ],
      "href": "/bff/v1/stores/arara/products",
      "title": "Ver o catálogo"
    }
  ]
}
