{
  "class": [
    "screen",
    "order",
    "live"
  ],
  "title": "Pedido 97856663872212992",
  "properties": {
    "orderId": "0199a2b4-6f1c-7a3e-9b2d-5c8e1f4a7d20",
    "orderNumber": "97856663872212992",
    "status": "shipped",
    "statusLabel": "A caminho",
    "tone": "info",
    "headline": "Seu pedido saiu para entrega com a Tucano Express.",
    "placedAt": "2026-09-28T05:10:11.000Z",
    "reservationExpiresAt": null,
    "total": {
      "amount": 15990,
      "currency": "BRL",
      "formatted": "R$ 159,90"
    },
    "trackingCode": "TX02Q6AGJQ45G00",
    "progress": [
      {
        "label": "Pedido feito",
        "state": "done",
        "at": "2026-09-28T05:10:11.000Z"
      },
      {
        "label": "Pagamento aprovado",
        "state": "done",
        "at": "2026-09-28T05:10:13.482Z"
      },
      {
        "label": "Preparando o envio",
        "state": "done",
        "at": "2026-09-28T05:10:14.120Z"
      },
      {
        "label": "A caminho",
        "state": "current"
      },
      {
        "label": "Entregue",
        "state": "upcoming"
      }
    ],
    "refreshAfterSeconds": 5
  },
  "entities": [
    {
      "class": [
        "order-line"
      ],
      "rel": [
        "item"
      ],
      "properties": {
        "sku": "BOOK-DDD-001",
        "name": "Domain-Driven Design",
        "quantity": 1,
        "unitPrice": {
          "amount": 15990,
          "currency": "BRL",
          "formatted": "R$ 159,90"
        },
        "subtotal": {
          "amount": 15990,
          "currency": "BRL",
          "formatted": "R$ 159,90"
        }
      }
    },
    {
      "class": [
        "timeline-step"
      ],
      "rel": [
        "https://github.com/flaviotinococoutinho/chaos_playground/blob/develop/contracts/http/bff/README.md#rel-history"
      ],
      "properties": {
        "status": "pending_payment",
        "label": "Pedido feito",
        "at": "2026-09-28T05:10:11.000Z"
      }
    },
    {
      "class": [
        "timeline-step"
      ],
      "rel": [
        "https://github.com/flaviotinococoutinho/chaos_playground/blob/develop/contracts/http/bff/README.md#rel-history"
      ],
      "properties": {
        "status": "paid",
        "label": "Pagamento aprovado",
        "at": "2026-09-28T05:10:13.482Z"
      }
    },
    {
      "class": [
        "timeline-step"
      ],
      "rel": [
        "https://github.com/flaviotinococoutinho/chaos_playground/blob/develop/contracts/http/bff/README.md#rel-history"
      ],
      "properties": {
        "status": "created",
        "label": "Pedido de envio criado",
        "at": "2026-09-28T05:10:14.120Z"
      }
    },
    {
      "class": [
        "timeline-step"
      ],
      "rel": [
        "https://github.com/flaviotinococoutinho/chaos_playground/blob/develop/contracts/http/bff/README.md#rel-history"
      ],
      "properties": {
        "status": "ready_for_pickup",
        "label": "Etiqueta pronta",
        "at": "2026-09-28T05:10:15.903Z"
      }
    },
    {
      "class": [
        "timeline-step"
      ],
      "rel": [
        "https://github.com/flaviotinococoutinho/chaos_playground/blob/develop/contracts/http/bff/README.md#rel-history"
      ],
      "properties": {
        "status": "picked_up",
        "label": "Coletado pela transportadora",
        "at": "2026-09-28T05:10:19.337Z"
      }
    },
    {
      "class": [
        "timeline-step"
      ],
      "rel": [
        "https://github.com/flaviotinococoutinho/chaos_playground/blob/develop/contracts/http/bff/README.md#rel-history"
      ],
      "properties": {
        "status": "out_for_delivery",
        "label": "Saiu para entrega",
        "at": "2026-09-28T05:10:20.012Z",
        "attempt": 1
      }
    },
    {
      "class": [
        "navigation"
      ],
      "rel": [
        "https://github.com/flaviotinococoutinho/chaos_playground/blob/develop/contracts/http/bff/README.md#rel-navigation"
      ],
      "properties": {
        "store": {
          "slug": "arara",
          "name": "Arara Livros",
          "palette": "arara",
          "initial": "A"
        },
        "shopper": {
          "profileId": "0199a2b4-5a1e-7c3d-8e4f-a1b2c3d4e5f6",
          "label": "Ana",
          "initial": "A"
        }
      },
      "links": [
        {
          "rel": [
            "https://github.com/flaviotinococoutinho/chaos_playground/blob/develop/contracts/http/bff/README.md#rel-stores"
          ],
          "href": "/bff/v1",
          "title": "Todas as lojas"
        },
        {
          "rel": [
            "https://github.com/flaviotinococoutinho/chaos_playground/blob/develop/contracts/http/bff/README.md#rel-store"
          ],
          "href": "/bff/v1/stores/arara",
          "title": "Arara Livros"
        },
        {
          "rel": [
            "https://github.com/flaviotinococoutinho/chaos_playground/blob/develop/contracts/http/bff/README.md#rel-catalog"
          ],
          "href": "/bff/v1/stores/arara/products",
          "title": "Catálogo"
        },
        {
          "rel": [
            "https://github.com/flaviotinococoutinho/chaos_playground/blob/develop/contracts/http/bff/README.md#rel-orders"
          ],
          "href": "/bff/v1/stores/arara/orders",
          "title": "Meus pedidos"
        },
        {
          "rel": [
            "https://github.com/flaviotinococoutinho/chaos_playground/blob/develop/contracts/http/bff/README.md#rel-profiles"
          ],
          "href": "/bff/v1/profiles?store=arara",
          "title": "Ana"
        }
      ]
    }
  ],
  "links": [
    {
      "rel": [
        "self"
      ],
      "href": "/bff/v1/stores/arara/orders/0199a2b4-6f1c-7a3e-9b2d-5c8e1f4a7d20"
    },
    {
      "rel": [
        "collection"
      ],
      "href": "/bff/v1/stores/arara/orders",
      "title": "Meus pedidos"
    },
    {
      "rel": [
        "https://github.com/flaviotinococoutinho/chaos_playground/blob/develop/contracts/http/bff/README.md#rel-track"
      ],
      "href": "/bff/v1/stores/arara/tracking/TX02Q6AGJQ45G00",
      "title": "Acompanhar a entrega"
    },
    {
      "rel": [
        "https://github.com/flaviotinococoutinho/chaos_playground/blob/develop/contracts/http/bff/README.md#rel-live"
      ],
      "href": "/api/tracking/v1/live?trackingCode=TX02Q6AGJQ45G00",
      "title": "Ver o entregador ao vivo"
    },
    {
      "rel": [
        "https://github.com/flaviotinococoutinho/chaos_playground/blob/develop/contracts/http/bff/README.md#rel-catalog"
      ],
      "href": "/bff/v1/stores/arara/products",
      "title": "Continuar comprando"
    }
  ]
}
