{
  "class": [
    "screen",
    "order",
    "live"
  ],
  "title": "Pedido PD02PX9D4HQ2R01",
  "properties": {
    "orderId": "0199a2b4-6f1c-7a3e-9b2d-5c8e1f4a7d20",
    "orderNumber": "PD02PX9D4HQ2R01",
    "status": "shipped",
    "statusLabel": "A caminho",
    "tone": "info",
    "placedAt": "2026-09-28T05:10:11.000Z",
    "reservationExpiresAt": "2026-09-28T05:25:11.000Z",
    "total": {
      "amount": 15990,
      "currency": "BRL",
      "formatted": "R$ 159,90"
    },
    "trackingCode": "TX02PX83TXC5G00",
    "refreshAfterSeconds": 5
  },
  "entities": [
    {
      "class": [
        "order-line"
      ],
      "rel": [
        "item"
      ],
      "properties": {
        "sku": "BOOK-DDD-001",
        "name": "Domain-Driven Design",
        "quantity": 1,
        "unitPrice": {
          "amount": 15990,
          "currency": "BRL",
          "formatted": "R$ 159,90"
        },
        "subtotal": {
          "amount": 15990,
          "currency": "BRL",
          "formatted": "R$ 159,90"
        }
      }
    }
  ],
  "links": [
    {
      "rel": [
        "self"
      ],
      "href": "/bff/v1/orders/0199a2b4-6f1c-7a3e-9b2d-5c8e1f4a7d20"
    },
    {
      "rel": [
        "https://github.com/flaviotinococoutinho/chaos_playground/blob/develop/contracts/http/bff/README.md#rel-track"
      ],
      "href": "/bff/v1/tracking/TX02PX83TXC5G00",
      "title": "Acompanhar a entrega"
    },
    {
      "rel": [
        "https://github.com/flaviotinococoutinho/chaos_playground/blob/develop/contracts/http/bff/README.md#rel-catalog"
      ],
      "href": "/bff/v1/products",
      "title": "Continuar comprando"
    }
  ]
}
